CBSA_name,CBSA_code,cntrlcnty,cntrlcntyfips,PrincipleCity,PrincipleCityStateFIPS,PrinCityFIPS,PrinCityLat,PrinCityLon
"Sioux Falls, SD Metropolitan Statistical Area                                   ",43620,"Minnehaha County, SD",46099,Sioux Falls city,46,4659020,43.549975,-96.700327
"South Bend-Mishawaka, IN-MI Metropolitan Statistical Area                       ",43780,"St. Joseph County, IN",18141,South Bend city,18,1871000,41.683381,-86.250007
"Spartanburg, SC Metropolitan Statistical Area                                   ",43900,"Spartanburg County, SC",45083,Spartanburg city,45,4568290,34.949567,-81.932048
"Spokane, WA Metropolitan Statistical Area                                       ",44060,"Spokane County, WA",53063,Spokane city,53,5367000,47.65878,-117.426047
"Springfield, IL Metropolitan Statistical Area                                   ",44100,"Sangamon County, IL",17167,Springfield city,17,1772000,39.781721,-89.650148
"Springfield, MA Metropolitan Statistical Area                                   ",44140,"Hampden County, MA",25013,Springfield city,25,2567000,42.101483,-72.589811
"Springfield, MO Metropolitan Statistical Area                                   ",44180,"Greene County, MO",29077,Springfield city,29,2970000,37.215326,-93.298244
"Springfield, OH Metropolitan Statistical Area                                   ",44220,"Clark County, OH",39023,Springfield city,39,3974118,39.924227,-83.808817
"State College, PA Metropolitan Statistical Area                                 ",44300,"Centre County, PA",42027,State College borough,42,4273808,40.793395,-77.860001
"Steubenville-Weirton, OH-WV Metropolitan Statistical Area                       ",44600,"Jefferson County, OH",39081,Steubenville,39,3974608,40.36979,-80.633964
"Stockton, CA Metropolitan Statistical Area                                      ",44700,"San Joaquin County, CA",6077,Stockton city,6,675000,37.957702,-121.29078
"Sumter, SC Metropolitan Statistical Area                                        ",44940,"Sumter County, SC",45085,Sumter city,45,4570405,33.920435,-80.341469
"Syracuse, NY Metropolitan Statistical Area                                      ",45060,"Onondaga County, NY",36067,Syracuse city,36,3673000,43.048122,-76.147424
"Tallahassee, FL Metropolitan Statistical Area                                   ",45220,"Leon County, FL",12073,Tallahassee city,12,1270600,30.438256,-84.280733
"Tampa-St. Petersburg-Clearwater, FL Metropolitan Statistical Area               ",45300,"Hillsborough County, FL",12057,Tampa city,12,1271000,27.949436,-82.465144
"Terre Haute, IN Metropolitan Statistical Area                                   ",45460,"Vigo County, IN",18167,Terre Haute city,18,1875428,39.466703,-87.413909
"Texarkana, TX-Texarkana, AR Metropolitan Statistical Area                       ",45500,"Miller County, AR",5091,Texarkana city,48,4872368,33.425125,-94.047688
"Toledo, OH Metropolitan Statistical Area                                        ",45780,"Lucas County, OH",39095,Toledo city,39,3977000,41.663938,-83.555212
"Topeka, KS Metropolitan Statistical Area                                        ",45820,"Shawnee County, KS",20177,Topeka city,20,2071000,39.055823,-95.689018
"Trenton-Ewing, NJ Metropolitan Statistical Area                                 ",45940,"Mercer County, NJ",34021,Trenton city,34,3474000,40.217053,-74.742938
"Tucson, AZ Metropolitan Statistical Area                                        ",46060,"Pima County, AZ",4019,Tucson city,4,477000,32.221743,-110.926479
"Tulsa, OK Metropolitan Statistical Area                                         ",46140,"Tulsa County, OK",40143,Tulsa city,40,4075000,36.153982,-95.992775
"Tuscaloosa, AL Metropolitan Statistical Area                                    ",46220,"Tuscaloosa County, AL",1125,Tuscaloosa city,1,177256,33.209841,-87.569173
"Tyler, TX Metropolitan Statistical Area                                         ",46340,"Smith County, TX",48423,Tyler city,48,4874144,32.35126,-95.301062
"Utica-Rome, NY Metropolitan Statistical Area                                    ",46540,"Oneida County, NY",36065,Utica city,36,3676540,43.100903,-75.232664
"Valdosta, GA Metropolitan Statistical Area                                      ",46660,"Lowndes County, GA",13185,Valdosta city,13,1378800,30.832702,-83.278485
"Vallejo-Fairfield, CA Metropolitan Statistical Area                             ",46700,"Solano County, CA",6095,Vallejo city,6,681666,38.104086,-122.256637
"Victoria, TX Metropolitan Statistical Area                                      ",47020,"Victoria County, TX",48469,Victoria city,48,4875428,28.805267,-97.003598
"Vineland-Millville-Bridgeton, NJ Metropolitan Statistical Area                  ",47220,"Cumberland County, NJ",34011,Vineland city,34,3476070,39.486227,-75.025731
"Virginia Beach-Norfolk-Newport News, VA-NC Metropolitan Statistical Area        ",47260,"Virginia Beach city, VA",51810,Virginia Beach city,51,5182000,36.852926,-75.977985
"Visalia-Porterville, CA Metropolitan Statistical Area                           ",47300,"Tulare County, CA",6107,Visalia city,6,682954,36.330228,-119.292058
"Waco, TX Metropolitan Statistical Area                                          ",47380,"McLennan County, TX",48309,Waco city,48,4876000,31.549333,-97.14667
"Warner Robins, GA Metropolitan Statistical Area                                 ",47580,"Houston County, GA",13153,Warner Robins city,13,1380508,32.608611,-83.638056
"Washington-Arlington-Alexandria, DC-VA-MD-WV Metropolitan Statistical Area      ",47900,"District of Columbia, DC",11001,Washington city,11,1150000,38.895112,-77.036366
"Waterloo-Cedar Falls, IA Metropolitan Statistical Area                          ",47940,"Black Hawk County, IA",19013,Waterloo city,19,1982425,42.492764,-92.342963
"Wausau, WI Metropolitan Statistical Area                                        ",48140,"Marathon County, WI",55073,Wausau city,55,5584475,44.959135,-89.630122
"Wenatchee-East Wenatchee, WA Metropolitan Statistical Area                      ",48300,"Chelan County, WA",53007,Wenatchee city,53,5377105,47.42346,-120.310349
"Wheeling, WV-OH Metropolitan Statistical Area                                   ",48540,"Ohio County, WV",54069,Wheeling city,54,5486452,40.063962,-80.720915
"Wichita, KS Metropolitan Statistical Area                                       ",48620,"Sedgwick County, KS",20173,Wichita city,20,2079000,37.692236,-97.337545
"Wichita Falls, TX Metropolitan Statistical Area                                 ",48660,"Wichita County, TX",48485,Wichita Falls city,48,4879000,33.913708,-98.493387
"Williamsport, PA Metropolitan Statistical Area                                  ",48700,"Lycoming County, PA",42081,Williamsport city,42,4285312,41.24119,-77.001091
"Wilmington, NC Metropolitan Statistical Area                                    ",48900,"New Hanover County, NC",37129,Wilmington city,37,3774440,34.225725,-77.94471
"Winchester, VA-WV Metropolitan Statistical Area                                 ",49020,"Winchester city, VA",51840,Winchester city,51,5186720,39.18566,-78.163334
"Winston-Salem, NC Metropolitan Statistical Area                                 ",49180,"Forsyth County, NC",37067,Winston-Salem city,37,3775000,36.103964,-80.254435
"Worcester, MA Metropolitan Statistical Area                                     ",49340,"Worcester County, MA",25027,Worcester city,25,2582000,42.262593,-71.802293
"Yakima, WA Metropolitan Statistical Area                                        ",49420,"Yakima County, WA",53077,Yakima city,53,5380010,46.602071,-120.505899
"York-Hanover, PA Metropolitan Statistical Area                                  ",49620,"York County, PA",42133,York city,42,4287048,39.962598,-76.727745
"Youngstown-Warren-Boardman, OH-PA Metropolitan Statistical Area                 ",49660,"Mahoning County, OH",39099,Youngstown city,39,3988000,41.09978,-80.649519
"Yuba City, CA Metropolitan Statistical Area                                     ",49700,"Sutter County, CA",6101,Yuba City city,6,686972,39.140448,-121.616911
"Yuma, AZ Metropolitan Statistical Area                                          ",49740,"Yuma County, AZ",4027,Yuma city,4,485540,32.692651,-114.627692